标题,地区,位置,具体位置,均价,平方米每元/单位,总价,类型,面积,标签,室厅数,均价/平方米每元
珠江广场,海珠,滨江东,海珠区滨江东路835号,80000, 元/㎡(均价),总价500-978(万/套),在售,建面 55-122㎡,"人车分流, 大型社区, 近地铁, 地铁沿线","2室, 3室","80000,  元/㎡(均价)"
品越华府,海珠,赤岗,金运路1号,140000, 元/㎡(均价),总价4700(万/套),在售,建面 325㎡,"车位充足, 人车分流, 国央企, 品牌房企",5室,"140000,  元/㎡(均价)"
城投湖山雅筑,花都,新区,商业大道城投湖山雅筑,23000, 元/㎡(均价),总价220-325(万/套),在售,建面 94-133㎡,"车位充足, 绿化率高, 国央企, 品牌房企","3室, 4室","23000,  元/㎡(均价)"
知城翰林湖畔花园,黄埔,知识城,创新大道知城翰林湖畔,18000, 元/㎡(均价),总价105-220(万/套),在售,建面 66-103㎡,"低单价, 低总价, 绿化率高, 人车分流","3室, 4室","18000,  元/㎡(均价)"
保利锦上印,荔湾,坑口,东漖街保利锦上印,价格待定,,,待售,,"人车分流, 大型社区, 国央企, 品牌房企",,价格待定
越秀万博城,番禺,汉溪长隆,万博CBD,51000, 元/㎡(均价),总价630-1000(万/套),在售,建面 103-188㎡,"车位充足, 绿化率高, 国央企, 品牌房企",4室,"51000,  元/㎡(均价)"
中国铁建花语上城,南沙,南沙区府,广州南沙蕉门河凤凰大道滨海实验学校（海语校区）对面,28500, 元/㎡(均价),总价275-420(万/套),在售,建面 98-140㎡,"车位充足, 人车分流, 国央企, 品牌房企","3室, 4室","28500,  元/㎡(均价)"
越秀·大学城·和樾府·飞鸟集,番禺,国际创新城,兴业大道越秀·大学城·和樾府,20000, 元/㎡(均价),总价70-96(万/套),在售,建面 35-46㎡,"车位充足, 人车分流, 国央企, 品牌房企",1室,"20000,  元/㎡(均价)"
中铁阅江来,南沙,南沙区府,黄阁南路中铁阅江来,24000, 元/㎡(均价),总价68-150(万/套),待售,建面 24-70㎡,"低总价, 车位充足, 人车分流, 国央企",1室,"24000,  元/㎡(均价)"
领峯中心,黄埔,科学城,联和街道岭胜广场,价格待定,,,待售,,"小型社区, 近地铁, 地铁沿线, 超市",,价格待定
大湾区诺德云城,白云,同德围,广东省广州市白云区棠乐路161号,32000, 元/㎡(均价),总价110-219(万/套),在售,建面 35-75㎡,"低总价, 国央企, 品牌房企, 近地铁","1室, 2室, 3室","32000,  元/㎡(均价)"
中建天钰,海珠,江燕路,广东省广州市海珠区工业大道南389号,60000, 元/㎡(均价),总价498-818(万/套),在售,建面 89-134㎡,"车位充足, 绿化率高, 国央企, 品牌房企","3室, 4室","60000,  元/㎡(均价)"
越秀·天荟江湾,海珠,工业大道南,广东省广州市海珠区大干围12号,800-1600, (万/套)(总价),,待售,建面 176-293㎡,"人车分流, 大型社区, 国央企, 品牌房企",,"800-1600,  (万/套)(总价)"
大壮名城,黄埔,科学城,开泰大道与科丰路交汇处,50000, 元/㎡(均价),总价450-860(万/套),在售,建面 88-143㎡,"特价好房, 车位充足, 绿化率高, 近地铁","2室, 4室","50000,  元/㎡(均价)"
中建未来方洲,黄埔,文冲,石化路中建未来方洲,42000, 元/㎡(均价),总价320-650(万/套),在售,建面 79-142㎡,"低总价, 车位充足, 绿化率高, 国央企","3室, 4室","42000,  元/㎡(均价)"
雍晟河滨广场,从化,新城片区,城南路雍晟河滨广场,15500, 元/㎡(均价),总价128-150(万/套),在售,建面 58-98㎡,"人车分流, 小型社区, 品牌房企, 地铁沿线",4室,"15500,  元/㎡(均价)"
智都绿城凤凰于飞,花都,新区,广东省广州市花都区凤凰北路,23000, 元/㎡(均价),总价249-350(万/套),在售,建面 108-144㎡,"车位充足, 人车分流, 国央企, 品牌房企","3室, 4室","23000,  元/㎡(均价)"
广州城投禧悦时光,花都,镜湖大道,花都区新雅街道安雅路1号,17000, 元/㎡(均价),总价125-210(万/套),在售,建面 78-118㎡,"低总价, 车位充足, 绿化率高, 国央企","3室, 4室","17000,  元/㎡(均价)"
广地花园,番禺,星河湾,广东省广州市番禺区,40000, 元/㎡(均价),总价450(万/套),在售,,"车位充足, 大型社区, 品牌房企, 地铁沿线",,"40000,  元/㎡(均价)"
保利珠江印象&保利珠江天悦,荔湾,东塱,广东省广州市荔湾区,48000, 元/㎡(均价),总价1020-2200(万/套),在售,建面 69-295㎡,"车位充足, 绿化率高, 国央企, 品牌房企",4室,"48000,  元/㎡(均价)"
益云科创中心,白云,龙归,广东省广州市白云区大源街道益云科创中心(建设中),价格待定,,,待售,,"车位充足, 人车分流, 地铁沿线, 超市",,价格待定
招商臻园,增城,新塘北,永宁街新福路,价格待定,,,待售,,"车位充足, 人车分流, 国央企, 品牌房企",,价格待定
广州城投禧悦府,增城,凤凰城,汽车城大道广州城投禧阅盛汇,38000, 元/㎡(均价),总价240(万/套),在售,,"大型社区, 国央企, 品牌房企, 近地铁",,"38000,  元/㎡(均价)"
中新知识城国际领军人才集聚区,黄埔,知识城,广东省广州市黄埔区中新广州知识城凤凰四路17号,价格待定,,,待售,,"小型社区, 近地铁, 地铁沿线, 综合商场",,价格待定
中旅璞樾天序,花都,旧区,广州市花都区秀全三街1-38号,19000, 元/㎡(均价),总价128-255(万/套),在售,建面 80-128㎡,"低总价, 人车分流, 大型社区, 国央企","3室, 4室","19000,  元/㎡(均价)"
花都城投翰林世家,花都,花山镇,平西村十二队二街花都城投翰林世家,18000, 元/㎡(均价),总价230-380(万/套),在售,建面 131-171㎡,"车位充足, 绿化率高, 国央企, 品牌房企",4室,"18000,  元/㎡(均价)"
增江创业广场,增城,荔城增江,纬六路增江创业广场,7850, 元/㎡(均价),总价26-37(万/套),在售,建面 34-46㎡,"人车分流, 小型社区, 公交直达, 小户型",1室,"7850,  元/㎡(均价)"
太古仓壹号,海珠,工业大道北,海珠区龙凤街金沙社区革新路,价格待定,,,待售,,"车位充足, 小型社区, 国央企, 品牌房企",,价格待定
广开·云翰,黄埔,知识城,广东省广州市黄埔区,20000, 元/㎡(均价),总价170-300(万/套),在售,建面 76-142㎡,"低单价, 低总价, 车位充足, 绿化率高",3室,"20000,  元/㎡(均价)"
智都越秀臻智府,花都,镜湖大道,广东省广州市花都区永利路,16800, 元/㎡(均价),总价130-180(万/套),在售,建面 78-108㎡,"低总价, 车位充足, 绿化率高, 国央企","3室, 4室","16800,  元/㎡(均价)"
珠江壹城·禧悦花园,从化,神岗镇,14号线神岗地铁站B出口,28000, 元/㎡(均价),总价62(万/套),在售,建面 31㎡,"车位充足, 人车分流, 品牌房企, 近地铁",1室,"28000,  元/㎡(均价)"
保利翔龙天汇,黄埔,科学城,广汕公路黄陂地铁站B出口(第一一七中学旁),27000, 元/㎡(均价),总价500(万/套),在售,,"车位充足, 人车分流, 国央企, 品牌房企",,"27000,  元/㎡(均价)"
广州兰园江悦,荔湾,滘口,滘口大街12号,60000, 元/㎡(均价),总价900-1600(万/套),在售,建面 193-285㎡,"车位充足, 绿化率高, 品牌房企, 近地铁","4室, 5室","60000,  元/㎡(均价)"
黄埔新福港鼎峰,黄埔,开发西区,广东省广州市黄埔区创业路103号,价格待定,,,待售,,小型社区,,价格待定
市政君睿,增城,增城区府,广州市增城区荔湖街道荔湖街道荔新一路7号之一,价格待定,,,在售,,"车位充足, 人车分流, 国央企, 品牌房企",,价格待定
君越府,越秀,三元里,广州市越秀区北站路71号君越府,价格待定,,,待售,,"人车分流, 小型社区, 近地铁, 地铁沿线",,价格待定
黄埔润府,黄埔,黄埔区府,大沙东路黄埔润府,价格待定,,,待售,,"小型社区, 国央企, 品牌房企, 近地铁",,价格待定
越秀·云悦,白云,沙太南,京溪街道越秀云悦,价格待定,,,在售,,"车位充足, 绿化率高, 国央企, 品牌房企",,价格待定
中交四航珠江春,黄埔,鱼珠,鱼珠街道中交四航珠江春,价格待定,,,在售,,"车位充足, 绿化率高, 国央企, 品牌房企",,价格待定
珠实·西关都荟,荔湾,南岸路,内环路珠实·西关都荟,价格待定,,,待售,,"小型社区, 国央企, 品牌房企, 近地铁",,价格待定
广州之窗商务港,海珠,沥滘,广东省广州市海珠区振兴大街18号,价格待定,,,待售,,"人车分流, 大型社区, 国央企, 品牌房企",,价格待定
越秀熙悦江湾,海珠,工业大道中,广纸商圈广纸东街AH050314地块,价格待定,,,待售,,"国央企, 品牌房企, 近地铁, 多轨交汇",,价格待定
越秀珑悦西关,荔湾,南岸路,河柳街越秀珑悦西关,50000, 元/㎡(均价),总价330-495(万/套),在售,建面 68-98㎡,"人车分流, 小型社区, 国央企, 品牌房企","2室, 3室","50000,  元/㎡(均价)"
招商林屿境,南沙,明珠湾,广东省广州市南沙区,30000, 元/㎡(均价),总价295(万/套),待售,建面 82-125㎡,"人车分流, 封闭管理, 国央企, 品牌房企",,"30000,  元/㎡(均价)"
中国美都,花都,镜湖大道,广东省广州市花都区凤凰南路73号之九,10000, 元/㎡(均价),总价950-2000(万/套),在售,建面 1020-1368㎡,"车位充足, 品牌房企, 地铁沿线, 公交直达","1室, 6室","10000,  元/㎡(均价)"
广州白云站.金街,白云,同德围,广东省广州市白云区棠乐路161号,55000, 元/㎡(均价),总价150-500(万/套),在售,建面 30-90㎡,"人车分流, 封闭管理, 国央企, 品牌房企",1室,"55000,  元/㎡(均价)"
云瀚府,越秀,东川路,白云路29-31号,43000, 元/㎡(均价),总价202-275(万/套),在售,建面 47-64㎡,"车位充足, 人车分流, 品牌房企, 近地铁","2室, 3室","43000,  元/㎡(均价)"
万博企业中心,番禺,汉溪长隆,汉溪大道东长隆万博悦府,40000, 元/㎡(均价),总价2000-12000(万/套),在售,建面 473-2979㎡,"车位充足, 人车分流, 国央企, 品牌房企","4室, 16室","40000,  元/㎡(均价)"
广汇新世界金融中心,增城,凤凰城,永宁街凤凰北横路1号,20000, 元/㎡(均价),总价650(万/套),在售,,"车位充足, 人车分流, 近地铁, 地铁沿线",,"20000,  元/㎡(均价)"
白云堡悦融居,白云,东平,白云大道北白云堡悦融居,22000, 元/㎡(均价),总价944-1146(万/套),在售,建面 294-439㎡,"车位充足, 人车分流, 置换改善, 地铁沿线","4室, 6室","22000,  元/㎡(均价)"
凯旋新世界广粤观邸,天河,珠江新城东,花城大道凯旋新世界广粤观邸,价格待定,,,在售,,"绿化率高, 人车分流, 近地铁, 多轨交汇",,价格待定
越秀桂悦东晓,海珠,东晓路,东晓路越秀桂悦东晓,价格待定,,,在售,,"小型社区, 国央企, 品牌房企, 近地铁",,价格待定
从化城投天悦湾,从化,鳌头镇,宝珠大道380号,6000, 元/㎡(均价),总价30-71(万/套),在售,建面 50-113㎡,"低单价, 低总价, 绿化率高, 人车分流",2室,"6000,  元/㎡(均价)"
领峯中心,黄埔,科学城,黄埔区科学大道以北、开泰大道以西领峯中心,价格待定,,,待售,,"人车分流, 小型社区, 近地铁, 地铁沿线",,价格待定
中建白云之星,白云,黄边,黄边北路63号,价格待定,,,待售,,"小型社区, 国央企, 品牌房企, 近地铁",,价格待定
珠江天河都荟,天河,智慧城,高塘路珠江天河都荟,价格待定,,,待售,,"小型社区, 国央企, 品牌房企, 近地铁",,价格待定
星河臻华府,黄埔,香雪,广州黄埔科学城云埔街道开创大道,价格待定,,,待售,,"车位充足, 大型社区, 品牌房企, 公交直达",,价格待定
琶洲樾华樾,海珠,磨碟沙,新港东路琶洲樾华樾,价格待定,,,在售,,"绿化率高, 人车分流, 国央企, 品牌房企",,价格待定
中恒海晖城,南海,小塘,佛山市南海区狮山镇桂丹路99号,9500, 元/㎡(均价),总价65-190(万/套),在售,建面 64-138㎡,"佛山楼盘, 低单价, 低总价, 绿化率高","2室, 3室, 4室","9500,  元/㎡(均价)"
泷景花园,禅城,澜石,澜石街道前进路19号,17500, 元/㎡(均价),总价160-400(万/套),在售,建面 85-189㎡,"佛山楼盘, 人车分流, 大型社区, 品牌房企","3室, 4室","17500,  元/㎡(均价)"
太平洋国际花园,顺德,陈村,赤花白陈路1号,16000, 元/㎡(均价),总价180-650(万/套),在售,建面 60-225㎡,"佛山楼盘, 低总价, 绿化率高, 人车分流","2室, 3室, 4室","16000,  元/㎡(均价)"
嘉濠雅苑,顺德,北滘,佛山市顺德区陈村镇南涌芸香围105国道18号,10500, 元/㎡(均价),总价100(万/套),在售,建面 87-90㎡,"佛山楼盘, 低单价, 低总价, 人车分流",2室,"10500,  元/㎡(均价)"
天晟·海琴湾,南海,丹灶,丹灶金沙大桥侧,8500, 元/㎡(均价),总价135-220(万/套),在售,建面 148-195㎡,"佛山楼盘, 低单价, 车位充足, 绿化率高","3室, 4室","8500,  元/㎡(均价)"
光明花半里,南海,罗村,狮山镇罗村大道南1号,12000, 元/㎡(均价),总价125-138(万/套),在售,建面 117-160㎡,"佛山楼盘, 低单价, 低总价, 人车分流",3室,"12000,  元/㎡(均价)"
珠水豪庭,南海,黄岐,黄岐北环路138号,32000, 元/㎡(均价),总价270-1000(万/套),在售,建面 87-221㎡,"佛山楼盘, 人车分流, 大型社区, 入户花园","3室, 4室, 5室","32000,  元/㎡(均价)"
中信山语湖,南海,里水,佛山市南海区里水镇和顺美景水库地段,9500, 元/㎡(均价),总价100-161(万/套),在售,建面 89-168㎡,"佛山楼盘, 低单价, 低总价, 人车分流","3室, 4室","9500,  元/㎡(均价)"
美立方花园,南海,狮山,狮山镇红星南路19号美立方花园,13000, 元/㎡(均价),总价125-171(万/套),在售,建面 90-143㎡,"佛山楼盘, 低单价, 低总价, 人车分流",2室,"13000,  元/㎡(均价)"
东圣维拉,顺德,容桂,容里骏晖路3号,9000, 元/㎡(均价),总价90-226(万/套),在售,建面 100-156㎡,"佛山楼盘, 低单价, 低总价, 绿化率高","3室, 4室","9000,  元/㎡(均价)"
广佛新世界,南海,大沥,佛山市南海区狮山镇高尔夫路333号,15000, 元/㎡(均价),总价180-255(万/套),在售,建面 71-161㎡,"佛山楼盘, 低总价, 绿化率高, 低密居所","3室, 4室","15000,  元/㎡(均价)"
藏珑华府,顺德,陈村,国通大道东2号,15000, 元/㎡(均价),总价140-400(万/套),在售,建面 95-171㎡,"佛山楼盘, 低总价, 绿化率高, 人车分流","2室, 3室","15000,  元/㎡(均价)"
博雅滨江,三水,西南街道,佛山市三水区西南街道文锋西路55号,8800, 元/㎡(均价),总价100-310(万/套),在售,建面 112-349㎡,"佛山楼盘, 车位充足, 绿化率高, 品牌房企","3室, 4室, 5室","8800,  元/㎡(均价)"
名铸家园,顺德,勒流,勒流育贤路8号,11800, 元/㎡(均价),总价120-244(万/套),在售,建面 93-195㎡,"佛山楼盘, 低单价, 低总价, 车位充足","3室, 4室, 5室","11800,  元/㎡(均价)"
美的鹭湖森林度假区,高明,杨和,高明大道中218号,8900, 元/㎡(均价),总价62.3-93.1(万/套),在售,建面 77-115㎡,"佛山楼盘, 绿化率高, 低密居所, 高品质小区","2室, 3室","8900,  元/㎡(均价)"
鸿安花园,三水,北江新区,西青大道23号,8300, 元/㎡(均价),总价80-136(万/套),在售,建面 91-143㎡,"佛山楼盘, 低单价, 人车分流, 大型社区","2室, 3室, 4室","8300,  元/㎡(均价)"
欧浦花城,高明,杨和,杨西大道133号,6000, 元/㎡(均价),总价55-67(万/套),在售,建面 97-115㎡,"佛山楼盘, 绿化率高, 人车分流, 公交直达",3室,"6000,  元/㎡(均价)"
明智雅苑,三水,云东海街道,佛山市三水区云东海街道明海路1号,7500, 元/㎡(均价),总价100-150(万/套),在售,建面 106-149㎡,"佛山楼盘, 低单价, 绿化率高, 低密居所","3室, 4室","7500,  元/㎡(均价)"
海骏达康格斯花园,顺德,大良西北区,105国道大良路段(大良古楼加油站旁),9500, 元/㎡(均价),总价177-211(万/套),在售,建面 88-153㎡,"佛山楼盘, 低单价, 低总价, 绿化率高","3室, 4室","9500,  元/㎡(均价)"
丽日坚美森林湖,三水,云东海街道,三水区云东海大道6号,7300, 元/㎡(均价),总价89-106(万/套),在售,建面 121-145㎡,"佛山楼盘, 低单价, 车位充足, 绿化率高","3室, 4室","7300,  元/㎡(均价)"
丽日坚美森林湖,三水,云东海街道,三水区云东海大道6号,12000, 元/㎡(均价),总价324-376(万/套),在售,建面 269-301㎡,"佛山楼盘, 低单价, 绿化率高, 人车分流","4室, 5室","12000,  元/㎡(均价)"
金钻华府,顺德,乐从,乐从大道东A106号,11000, 元/㎡(均价),总价55-115(万/套),在售,建面 43-84㎡,"佛山楼盘, 低单价, 低总价, 人车分流","1室, 2室","11000,  元/㎡(均价)"
圣德嘉园,禅城,南庄,南庄镇南庄二马路102号,7500, 元/㎡(均价),总价73-90(万/套),在售,建面 87-106㎡,"佛山楼盘, 低单价, 低总价, 人车分流",3室,"7500,  元/㎡(均价)"
美的西江府,顺德,龙江,悦江路3号,8300, 元/㎡(均价),总价165-193(万/套),在售,建面 89-143㎡,"佛山楼盘, 低单价, 低总价, 绿化率高",4室,"8300,  元/㎡(均价)"
天晟·海琴湾,南海,丹灶,丹灶金沙大桥南侧,23000, 元/㎡(均价),总价700-2000(万/套),在售,建面 248-813㎡,"佛山楼盘, 车位充足, 绿化率高, 置换改善","5室, 6室, 7室","23000,  元/㎡(均价)"
金地艺境天成,三水,大塘,广东省佛山市三水区大塘镇大布沙锦塘路12号,6500, 元/㎡(均价),总价60-95(万/套),在售,建面 85-140㎡,"佛山楼盘, 低单价, 低总价, 人车分流","2室, 3室","6500,  元/㎡(均价)"
中粮珑湾祥云,禅城,湖景,东平路中粮珑湾祥云,22000, 元/㎡(均价),总价190-320(万/套),在售,建面 96-172㎡,"佛山楼盘, 人车分流, 小型社区, 国央企","3室, 4室","22000,  元/㎡(均价)"
望德8号,禅城,湖景,奇槎华祥路10号,15500, 元/㎡(均价),总价135-200(万/套),在售,建面 87-117㎡,"佛山楼盘, 低总价, 人车分流, 大型社区","3室, 4室","15500,  元/㎡(均价)"
金融街金悦府,三水,云东海街道,广东省佛山市三水新城云庭大道7号（三水北站轻轨站旁）,9000, 元/㎡(均价),总价83-168(万/套),在售,建面 95-160㎡,"佛山楼盘, 绿化率高, 人车分流, 国央企","2室, 3室, 4室","9000,  元/㎡(均价)"
中雅江湾,顺德,乐从,创富三路中交雅居乐中雅江湾,13000, 元/㎡(均价),总价120-200(万/套),在售,建面 98-140㎡,"佛山楼盘, 低总价, 绿化率高, 人车分流","3室, 4室","13000,  元/㎡(均价)"
坚美园,鹤山市,鹤山市,鹤山市沙坪街道鹤山大道南（汽车总站对面）,6600, 元/㎡(均价),总价61-492(万/套),在售,建面 76-161㎡,"楼盘, 绿化率高, 大型社区, 品牌房企","3室, 4室","6600,  元/㎡(均价)"
南景湾山水城,鹤山市,鹤山市,鹤山市沙坪街道文明路南景华府旁（鹤山一中运动场南侧）,5988, 元/㎡(均价),总价84-102(万/套),在售,建面 115-178㎡,"楼盘, 绿化率高, 人车分流, 公交直达","3室, 4室","5988,  元/㎡(均价)"
中宝温馨家园,鹤山市,鹤山市,广东省江门市鹤山市前进南路36号,5800, 元/㎡(均价),总价60-90(万/套),在售,建面 83-145㎡,"楼盘, 绿化率高, 人车分流, 品牌房企","2室, 3室, 4室","5800,  元/㎡(均价)"
电建地产·洺悦半岛,顺德,勒流,勒流街道电建地产·洺悦半岛,9500, 元/㎡(均价),总价105-162(万/套),在售,建面 105-171㎡,"佛山楼盘, 低单价, 低总价, 绿化率高","3室, 4室","9500,  元/㎡(均价)"
雲璟上筑,顺德,伦教,龙州公路顺德汽车产业园,7500, 元/㎡(均价),总价23-46(万/套),在售,建面 27-38㎡,"佛山楼盘, 低单价, 低总价, 小型社区",1室,"7500,  元/㎡(均价)"
金地艺境天成,三水,大塘,三水·大塘新城（珠三角环线北江东出口月亮湖旁）,12000, 元/㎡(均价),总价140-250(万/套),在售,建面 140-211㎡,"佛山楼盘, 低单价, 低总价, 人车分流","3室, 4室","12000,  元/㎡(均价)"
保利新汇城,禅城,祖庙,禅城区佛罗公路45号之一,12500, 元/㎡(均价),总价115-155(万/套),在售,建面 86-122㎡,"佛山楼盘, 低单价, 低总价, 人车分流","3室, 4室","12500,  元/㎡(均价)"
金地艺境天成,三水,大塘,广东省佛山市三水区大塘镇锦塘路12号,9000, 元/㎡(均价),总价13-253(万/套),在售,建面 13-253㎡,"佛山楼盘, 低单价, 低总价, 品牌房企",1室,"9000,  元/㎡(均价)"
创雄华府,三水,北江新区,佛山市三水区西南街道建设二路2号,8800, 元/㎡(均价),总价85-123(万/套),在售,建面 101-128㎡,"佛山楼盘, 低总价, 小型社区, 封闭管理","3室, 4室","8800,  元/㎡(均价)"
桂南星晴公馆,南海,桂城,南桂东路桂南星晴公馆,18500, 元/㎡(均价),总价130-225(万/套),在售,建面 68-121㎡,"佛山楼盘, 人车分流, 小型社区, 贴心物业","2室, 3室, 4室","18500,  元/㎡(均价)"
泷景花园,禅城,澜石,澜石街道前进路19号,12000, 元/㎡(均价),总价33-85(万/套),在售,建面 28-78㎡,"佛山楼盘, 低总价, 人车分流, 大型社区","1室, 3室","12000,  元/㎡(均价)"
中国铁建领秀公馆,顺德,北滘,广东省佛山市顺德区三乐路南7号,13000, 元/㎡(均价),总价140-270(万/套),在售,建面 90-142㎡,"佛山楼盘, 绿化率高, 人车分流, 国央企","2室, 3室, 4室","13000,  元/㎡(均价)"
华业丽景花园,鹤山市,鹤山市,鹤城325国道与270省道交汇处,5200, 元/㎡(均价),总价41.6-79(万/套),在售,建面 76-137㎡,"楼盘, 低单价, 绿化率高, 人车分流","2室, 3室, 4室","5200,  元/㎡(均价)"
碧桂园天麓湖,鹤山市,鹤山市,江鹤高速共和出口天麓湖风景区,6000, 元/㎡(均价),总价65-75(万/套),在售,建面 84-120㎡,"楼盘, 车位充足, 绿化率高, 置换改善","2室, 4室","6000,  元/㎡(均价)"
中交·诚湾悦府,顺德,杏坛,佛山市顺德杏坛镇高新区德富路58号,11000, 元/㎡(均价),总价80-185(万/套),在售,建面 88-133㎡,"佛山楼盘, 低单价, 低总价, 车位充足","3室, 4室","11000,  元/㎡(均价)"
保利中交大都汇,禅城,绿岛湖,季华路保利中交大都汇,13000, 元/㎡(均价),总价160-220(万/套),在售,建面 75-142㎡,"佛山楼盘, 低单价, 低总价, 绿化率高","3室, 4室","13000,  元/㎡(均价)"
阅海,南海,里水,沿江北三路阅海,13000, 元/㎡(均价),总价120-280(万/套),在售,建面 90-452㎡,"佛山楼盘, 低单价, 低总价, 人车分流","2室, 3室, 4室","13000,  元/㎡(均价)"
富佳和院,南海,大沥,大沥振兴路60号,17000, 元/㎡(均价),总价147-230(万/套),在售,建面 82-122㎡,"佛山楼盘, 车位充足, 人车分流, 贴心物业",3室,"17000,  元/㎡(均价)"
润立华庭,四会,大旺,大旺大道与政德街交汇处,5500, 元/㎡(均价),总价57-80(万/套),在售,建面 82-121㎡,"楼盘, 低单价, 低总价, 人车分流","2室, 4室","5500,  元/㎡(均价)"
君山新城,四会,大旺,肇庆市大旺高新区建设路君山新城,6400, 元/㎡(均价),总价45-110(万/套),在售,建面 65-144㎡,"楼盘, 低总价, 绿化率高, 人车分流","2室, 3室, 4室","6400,  元/㎡(均价)"
御东方,四会,大旺,大旺高新区工业大街与建设路交叉口东120米,6500, 元/㎡(均价),总价60-117.3(万/套),在售,建面 83-162㎡,"楼盘, 人车分流, 大型社区, 健身跑道","2室, 3室, 4室","6500,  元/㎡(均价)"
唯美·臻岸华府,顺德,大良北区,新基北路唯美·臻岸华府,15000, 元/㎡(均价),总价175-420(万/套),在售,建面 98-234㎡,"佛山楼盘, 车位充足, 人车分流, 健身跑道","3室, 4室, 5室","15000,  元/㎡(均价)"
金融街仙湖悦府,南海,丹灶,丹灶镇仙湖度假区环湖路16号,10000, 元/㎡(均价),总价90-150(万/套),在售,建面 103-143㎡,"佛山楼盘, 低单价, 低总价, 车位充足","3室, 4室","10000,  元/㎡(均价)"
东澳御园,四会,大旺,高新区·大旺大道与政德大街交汇处,6000, 元/㎡(均价),总价45-60(万/套),在售,建面 79-98㎡,"楼盘, 低单价, 绿化率高, 人车分流","3室, 4室","6000,  元/㎡(均价)"
实地紫藤公馆,顺德,容桂,长业路1号,9000, 元/㎡(均价),总价85-150(万/套),在售,建面 93-127㎡,"佛山楼盘, 低单价, 低总价, 车位充足","3室, 4室","9000,  元/㎡(均价)"
君临天下（富士花园）,高要区,高要,肇庆市高要区白土镇高峰路6号,5000, 元/㎡(均价),总价29.8-80(万/套),在售,建面 54-151㎡,"楼盘, 低单价, 低总价, 大型社区","2室, 3室, 4室","5000,  元/㎡(均价)"
星湖裕园,端州区,端州,端州区北岭七星路18号,9000, 元/㎡(均价),总价175-780(万/套),在售,建面 209-700㎡,"楼盘, 车位充足, 人车分流, 置换改善","3室, 5室, 6室","9000,  元/㎡(均价)"
华福·珑熹水岸,高明,荷城,荷城城区泰华路与学舟街交汇处（高明纪念中学旁）,7500, 元/㎡(均价),总价75-122(万/套),在售,建面 96-141㎡,"佛山楼盘, 人车分流, 大型社区, 品牌房企","3室, 4室","7500,  元/㎡(均价)"
天宝豪庭,顺德,杏坛,佛山市顺德区杏龙路37号,8800, 元/㎡(均价),总价85-138(万/套),在售,建面 96-120㎡,"佛山楼盘, 低单价, 低总价, 人车分流",3室,"8800,  元/㎡(均价)"
保利天际,南海,千灯湖,海五路保利天际,13000, 元/㎡(均价),总价170-210(万/套),在售,建面 74-133㎡,"佛山楼盘, 人车分流, 小型社区, 国央企",1室,"13000,  元/㎡(均价)"
