标题,地区,位置,具体位置,均价,平方米每元/单位,总价,类型,面积,标签,室厅数,均价/平方米每元
保利珺悦府,顺德,北滘,北滘新城美的大道站D出口,19500, 元/㎡(均价),总价480(万/套),在售,建面 119-240㎡,"佛山楼盘, 车位充足, 人车分流, 国央企",4室,"19500,  元/㎡(均价)"
鸿升·春江明月（春江明月花园）,鹤山市,鹤山市,西江大堤鸿升·春江明月,15000, 元/㎡(均价),总价320-332(万/套),在售,建面 202-221㎡,"楼盘, 人车分流, 大型社区, 品牌房企",6室,"15000,  元/㎡(均价)"
保利珺悦府,顺德,北滘,美的大道保利珺悦府,26000, 元/㎡(均价),总价550(万/套),在售,建面 196㎡,"佛山楼盘, 车位充足, 人车分流, 国央企",4室,"26000,  元/㎡(均价)"
城发·悦城峯境,禅城,张槎,东平路城发·悦城峯境,22000, 元/㎡(均价),总价430-800(万/套),在售,建面 178-345㎡,"佛山楼盘, 车位充足, 人车分流, 国央企","3室, 4室","22000,  元/㎡(均价)"
樵顺花苑,高明,荷城,大成路樵顺花苑,7500, 元/㎡(均价),总价71-93(万/套),在售,建面 91-120㎡,"佛山楼盘, 人车分流, 小型社区, 小三居","3室, 4室","7500,  元/㎡(均价)"
顺控金地熙悦湾,顺德,勒流,顺德区勒流街道南国西路以南、龙海路以西,8500, 元/㎡(均价),总价75-115(万/套),在售,建面 86-130㎡,"佛山楼盘, 低单价, 低总价, 人车分流","2室, 3室, 4室","8500,  元/㎡(均价)"
华福·金湾水岸,顺德,伦教,广东省佛山市顺德区,13000, 元/㎡(均价),总价115-270(万/套),在售,建面 94-175㎡,"佛山楼盘, 低总价, 人车分流, 封闭管理","2室, 4室","13000,  元/㎡(均价)"
保利天悦,南海,千灯湖,清风西路保利天悦,18000, 元/㎡(均价),总价130-500(万/套),在售,建面 63-188㎡,"佛山楼盘, 车位充足, 人车分流, 国央企","1室, 2室, 3室","18000,  元/㎡(均价)"
锦绣春江花园,鼎湖区,鼎湖,天后路锦绣春江花园,6000, 元/㎡(均价),总价48-79(万/套),在售,建面 71-126㎡,"楼盘, 人车分流, 封闭管理, 旅游地产","2室, 3室, 4室","6000,  元/㎡(均价)"
溪湾华府,高要区,,肇庆市高要区大湾镇平埔开发区怡发工业大道8号,4800, 元/㎡(均价),总价39-53(万/套),在售,建面 94-127㎡,"楼盘, 低单价, 低总价, 绿化率高","3室, 4室","4800,  元/㎡(均价)"
保利天汇,南海,平洲,佛山市南海区清风路桂城街道,35000, 元/㎡(均价),总价330-1500(万/套),在售,建面 128-299㎡,"佛山楼盘, 车位充足, 人车分流, 国央企","4室, 5室","35000,  元/㎡(均价)"
凯景半岛,高明,荷城,苏河路凯景半岛,8000, 元/㎡(均价),总价66-90(万/套),在售,建面 82-120㎡,"佛山楼盘, 人车分流, 小型社区, 公交直达","3室, 4室","8000,  元/㎡(均价)"
啟骏琅逸轩,南海,黄岐,广东省佛山市南海区黄海路26号,22000, 元/㎡(均价),总价220(万/套),在售,建面 105㎡,"佛山楼盘, 低密居所, 人车分流, 公交直达",3室,"22000,  元/㎡(均价)"
保利三龙湾天珺,禅城,湖景,东平路保利三龙湾天珺,40000, 元/㎡(均价),总价970-1600(万/套),在售,建面 192-354㎡,"佛山楼盘, 车位充足, 人车分流, 国央企","4室, 5室","40000,  元/㎡(均价)"
越秀星汇文瀚,南海,平洲,夏东路越秀星汇文瀚,23000, 元/㎡(均价),总价175-275(万/套),在售,建面 85-115㎡,"佛山楼盘, 人车分流, 小型社区, 国央企","3室, 4室","23000,  元/㎡(均价)"
融基齐家湖壹号,三水,乐平,佛山市三水区乐平镇儒家天下文化公园旁,9500, 元/㎡(均价),总价95-170(万/套),在售,建面 98-178㎡,"佛山楼盘, 特价好房, 车位充足, 绿化率高","3室, 4室","9500,  元/㎡(均价)"
天樾华园,禅城,澜石,广东省佛山市禅城区黎明路8号,15500, 元/㎡(均价),总价140-238(万/套),在售,建面 93-139㎡,"佛山楼盘, 低总价, 车位充足, 绿化率高","3室, 4室","15500,  元/㎡(均价)"
君汇熙庭,四会,,汇林路君汇熙庭,6800, 元/㎡(均价),总价45-55(万/套),在售,建面 67-108㎡,"楼盘, 低总价, 人车分流, 大型社区","2室, 3室","6800,  元/㎡(均价)"
城发灯湖悦园,禅城,祖庙,佛山市禅城区海五路与货站路交汇处,16000, 元/㎡(均价),总价135-200(万/套),在售,建面 83-118㎡,"佛山楼盘, 人车分流, 大型社区, 国央企","2室, 3室, 4室","16000,  元/㎡(均价)"
保利新汇城,禅城,祖庙,广东省佛山市禅城区佛罗路45号,25000, 元/㎡(均价),总价170(万/套),在售,,"佛山楼盘, 人车分流, 大型社区, 国央企",,"25000,  元/㎡(均价)"
捷和广场三期水溋坊,三水,云东海街道,南丰大道捷和广场三期水溋坊,8600, 元/㎡(均价),总价68-118(万/套),在售,建面 80-119㎡,"佛山楼盘, 低总价, 绿化率高, 人车分流","2室, 3室, 4室","8600,  元/㎡(均价)"
东建映月湖壹号,南海,平洲,和洲路东建映月湖壹号,35000, 元/㎡(均价),总价500-1300(万/套),在售,建面 160-320㎡,"佛山楼盘, 车位充足, 人车分流, 品牌房企","4室, 5室","35000,  元/㎡(均价)"
华侨城天鹅堡二期,顺德,大良东区,佛山市顺德区大良街道欢乐大道2号,22000, 元/㎡(均价),总价240-820(万/套),在售,建面 109-315㎡,"佛山楼盘, 车位充足, 人车分流, 国央企","3室, 4室, 5室","22000,  元/㎡(均价)"
建发融创和玺,三水,云东海街道,广东省佛山市三水区韵丰路,25000, 元/㎡(均价),总价60-160(万/套),在售,建面 16-81㎡,"佛山楼盘, 人车分流, 封闭管理, 国央企",1室,"25000,  元/㎡(均价)"
顺控•桂樾台,顺德,容桂,文海西路12号,9500, 元/㎡(均价),总价85-125(万/套),在售,建面 89-125㎡,"佛山楼盘, 优惠楼盘, 低单价, 封闭管理","2室, 3室","9500,  元/㎡(均价)"
九峯台,高明,荷城,高明区荷城街道秀湾路88号,9500, 元/㎡(均价),总价156-190(万/套),在售,建面 165-200㎡,"佛山楼盘, 车位充足, 人车分流, 公交直达",4室,"9500,  元/㎡(均价)"
北岸美庐,顺德,乐从,佛山市顺德区沙滘北村美景路1号,10000, 元/㎡(均价),总价128-400(万/套),在售,建面 107-350㎡,"佛山楼盘, 低单价, 人车分流, 封闭管理","3室, 4室, 6室","10000,  元/㎡(均价)"
顺伦海心明月,顺德,伦教,顺德区彩虹路与奋业路交叉口东北120米,11000, 元/㎡(均价),总价75-140(万/套),在售,建面 75-120㎡,"佛山楼盘, 低单价, 低总价, 人车分流","2室, 3室","11000,  元/㎡(均价)"
保利琅悦,南海,桂城,南海-石啃/桂澜路保利琅悦,25000, 元/㎡(均价),总价210-520(万/套),在售,建面 89-173㎡,"佛山楼盘, 人车分流, 大型社区, 国央企","3室, 4室","25000,  元/㎡(均价)"
建发灯湖天峯,南海,大沥,广东省佛山市南海区新村大街23巷,32000, 元/㎡(均价),总价400-500(万/套),在售,建面 131-151㎡,"佛山楼盘, 绿化率高, 人车分流, 国央企",4室,"32000,  元/㎡(均价)"
建发灯湖缦云,南海,盐步,岳利沙路建发灯湖缦云,45000, 元/㎡(均价),总价700-2000(万/套),在售,建面 175-338㎡,"佛山楼盘, 车位充足, 人车分流, 国央企","4室, 5室","45000,  元/㎡(均价)"
华侨城半月岛纯水岸,禅城,湖景,东平路华侨城半月岛纯水岸,31000, 元/㎡(均价),总价350-873(万/套),在售,建面 140-227㎡,"佛山楼盘, 人车分流, 封闭管理, 国央企",4室,"31000,  元/㎡(均价)"
万科世纪灯湖·瑧府,南海,千灯湖,华翠北路万科瑧府,50000, 元/㎡(均价),总价600-1100(万/套),在售,建面 143-237㎡,"佛山楼盘, 车位充足, 绿化率高, 国央企","3室, 4室","50000,  元/㎡(均价)"
滨江嘉苑,端州区,,二塔路滨江嘉苑,9800, 元/㎡(均价),总价110-140(万/套),在售,建面 102-139㎡,"楼盘, 人车分流, 小型社区, 公交直达","3室, 4室","9800,  元/㎡(均价)"
保利和著,南海,平洲,深海路保利和著,24000, 元/㎡(均价),总价270-490(万/套),在售,建面 119-163㎡,"佛山楼盘, 车位充足, 人车分流, 国央企",4室,"24000,  元/㎡(均价)"
裕桂楼,南海,桂城,广东省佛山市南海区南新一路9号,20000, 元/㎡(均价),总价180-220(万/套),在售,建面 91-114㎡,"佛山楼盘, 人车分流, 小型社区, 近地铁","2室, 3室","20000,  元/㎡(均价)"
汇景园,鼎湖区,鼎湖,民乐大道汇景园,5200, 元/㎡(均价),总价46-65(万/套),在售,建面 87-117㎡,"楼盘, 低单价, 低总价, 绿化率高","3室, 4室","5200,  元/㎡(均价)"
丽江蓝湾,高要区,,文峰路丽江蓝湾,4900, 元/㎡(均价),总价35-45(万/套),在售,建面 67-84㎡,"楼盘, 低单价, 低总价, 人车分流","2室, 3室","4900,  元/㎡(均价)"
怡亚通珑樾,禅城,岭南大道,文华中路怡亚通珑樾,22000, 元/㎡(均价),总价275-315(万/套),在售,建面 123-142㎡,"佛山楼盘, 车位充足, 低密居所, 国央企",3室,"22000,  元/㎡(均价)"
新希望悦珑湾,顺德,陈村,广东省佛山市顺德区,25000, 元/㎡(均价),总价139(万/套),在售,,"佛山楼盘, 人车分流, 封闭管理, 品牌房企",,"25000,  元/㎡(均价)"
颐安·雍悦华府,三水,北江新区,三水区西南街道口岸达到22号,20000, 元/㎡(均价),总价50-160(万/套),在售,建面 23-97㎡,"佛山楼盘, 人车分流, 封闭管理, 品牌房企",1室,"20000,  元/㎡(均价)"
顺控博悦湾新翼,顺德,顺德碧桂园,佛山顺德北滘碧桂园社区科贤路1号,11000, 元/㎡(均价),总价166-186(万/套),在售,建面 123-138㎡,"佛山楼盘, 低单价, 低总价, 人车分流",4室,"11000,  元/㎡(均价)"
中盛龙骧水岸,南海,大沥,佛山南海大沥广佛路太平牌坊旁,15500, 元/㎡(均价),总价150-203(万/套),在售,建面 88-118㎡,"佛山楼盘, 人车分流, 小型社区, 品牌房企","2室, 3室","15500,  元/㎡(均价)"
致美家园,南海,狮山,佛山市南海区狮山镇博华路2号,16000, 元/㎡(均价),总价220-1000(万/套),在售,建面 134-392㎡,"佛山楼盘, 车位充足, 人车分流, 品牌房企","3室, 4室, 5室","16000,  元/㎡(均价)"
岭南华曦府,顺德,大良东区,东乐路岭南华曦府,17000, 元/㎡(均价),总价166-243(万/套),在售,建面 98-135㎡,"佛山楼盘, 人车分流, 封闭管理, 国央企","3室, 4室","17000,  元/㎡(均价)"
江鹤1号,鹤山市,鹤山市,大岗路江鹤1号,7000, 元/㎡(均价),总价53-82(万/套),在售,建面 89-143㎡,"楼盘, 车位充足, 人车分流, 小三居","3室, 4室","7000,  元/㎡(均价)"
春风潮鸣花园,鹤山市,鹤山市,江门鹤山市沙坪城区古劳水乡东坡公园旁,7750, 元/㎡(均价),总价57-68(万/套),在售,建面 83-103㎡,"楼盘, 人车分流, 大型社区, 品牌房企","3室, 4室","7750,  元/㎡(均价)"
春风潮鸣花园,鹤山市,鹤山市,沙坪街道春风潮鸣花园,10000, 元/㎡(均价),总价220-235(万/套),在售,建面 214-231㎡,"楼盘, 人车分流, 大型社区, 品牌房企","4室, 5室","10000,  元/㎡(均价)"
顺峰府,顺德,大良东区,广东省佛山市顺德区新桂中路9号,17000, 元/㎡(均价),总价148-600(万/套),在售,建面 90-300㎡,"佛山楼盘, 车位充足, 绿化率高, 近地铁","2室, 3室, 4室","17000,  元/㎡(均价)"
新怡明德世家,南海,盐步,佛山南海大沥皇朝西路与建设西路交汇处,13500, 元/㎡(均价),总价125-195(万/套),在售,建面 93-137㎡,"佛山楼盘, 低单价, 人车分流, 小型社区","3室, 4室","13500,  元/㎡(均价)"
东建天赋龙湾,禅城,张槎,佛山禅城张槎忠信路北侧、华富路西侧、智慧路南侧,18500, 元/㎡(均价),总价150-403(万/套),在售,建面 97-187㎡,"佛山楼盘, 绿化率高, 人车分流, 品牌房企","3室, 4室","18500,  元/㎡(均价)"
智信明轩,高明,荷城,祥如路23号,6300, 元/㎡(均价),总价57-68(万/套),在售,建面 95-108㎡,"佛山楼盘, 人车分流, 小型社区, 公交直达",3室,"6300,  元/㎡(均价)"
博雅滨江,三水,西南街道,文锋西路55号花果山,20000, 元/㎡(均价),总价57-137(万/套),在售,建面 28-68㎡,"佛山楼盘, 车位充足, 人车分流, 品牌房企",1室,"20000,  元/㎡(均价)"
捷和广场三期水溋坊,三水,云东海街道,南丰大道捷和广场三期水溋坊,25000, 元/㎡(均价),总价104.4-164.9(万/套),在售,建面 22-65㎡,"佛山楼盘, 低总价, 人车分流, 封闭管理",1室,"25000,  元/㎡(均价)"
桐林天晋,南海,盐步,南海-盐步/盐秀路1号之二,17000, 元/㎡(均价),总价137-201(万/套),在售,建面 89-115㎡,"佛山楼盘, 人车分流, 小型社区, 公交直达","2室, 3室","17000,  元/㎡(均价)"
涛汇鎏金湾二期·瑞府,顺德,大良新区,佛山顺德大良南江社区德胜西路10号,15000, 元/㎡(均价),总价195-225(万/套),在售,建面 120-140㎡,"佛山楼盘, 绿化率高, 人车分流, 公交直达","3室, 4室","15000,  元/㎡(均价)"
怡亚通珑樾,禅城,岭南大道,地铁湾华站北行约200米,18000, 元/㎡(均价),总价1100(万/套),在售,,"佛山楼盘, 车位充足, 人车分流, 国央企",,"18000,  元/㎡(均价)"
藏珑华府,顺德,陈村,顺德-陈村/佛山广珠西线石洲出口西侧800米,8800, 元/㎡(均价),总价30-50(万/套),在售,建面 39-58㎡,"佛山楼盘, 低单价, 人车分流, 封闭管理","1室, 2室","8800,  元/㎡(均价)"
智富新天地,顺德,杏坛,佛山顺德杏坛高赞村高桂大道北28号,7800, 元/㎡(均价),总价54-83(万/套),在售,建面 72-107㎡,"佛山楼盘, 低单价, 低总价, 人车分流","3室, 4室","7800,  元/㎡(均价)"
中兴汇富居,鹤山市,鹤山市,铁夫路中兴汇富居,6800, 元/㎡(均价),总价49-150(万/套),在售,建面 76-189㎡,"楼盘, 绿化率高, 人车分流, 公交直达","3室, 4室, 5室","6800,  元/㎡(均价)"
桃园高尔夫豪庭,南海,松岗,南海区狮山镇桃影路8号,20000, 元/㎡(均价),总价480-2300(万/套),在售,建面 396-973㎡,"佛山楼盘, 人车分流, 小型社区, 置换改善","6室, 7室, 8室","20000,  元/㎡(均价)"
万和融禧公馆,南海,千灯湖,桂城街道万和融禧公馆,17000, 元/㎡(均价),总价130-225(万/套),在售,建面 71-122㎡,"佛山楼盘, 小型社区, 封闭管理, 多轨交汇","2室, 3室","17000,  元/㎡(均价)"
大学城•禾粤,南海,狮山,佛山南海狮山和众路3号,7500, 元/㎡(均价),总价70-100(万/套),在售,建面 88-123㎡,"佛山楼盘, 低单价, 低总价, 人车分流","3室, 4室","7500,  元/㎡(均价)"
天健汇,天河,车陂,车陂北路（天坤三路与健明四路交汇处）,37500, 元/㎡(均价),总价135(万/套),售罄,建面 36-51㎡,"人车分流, 小型社区, 国央企, 品牌房企","1室, 3室","37500,  元/㎡(均价)"
绿地云央,白云,太和,草塘路5号,27500, 元/㎡(均价),总价275(万/套),售罄,建面 98-138㎡,"车位充足, 人车分流, 国央企, 品牌房企","3室, 4室","27500,  元/㎡(均价)"
智杰雅筑,从化,河滨北路,向阳路32号,11000, 元/㎡(均价),总价140(万/套),售罄,建面 90-242㎡,"绿化率高, 人车分流, 入户花园, 贴心物业","3室, 5室","11000,  元/㎡(均价)"
南华时代城,花都,铁路西,新华街工业大道18号,20000, 元/㎡(均价),总价220(万/套),售罄,建面 105-124㎡,"人车分流, 大型社区, 健身跑道, 地铁沿线",3室,"20000,  元/㎡(均价)"
公园里（春晓花园）,增城,荔城增江,广汕公路与增江大道南交汇处（天恩小学对面）,9800, 元/㎡(均价),,售罄,建面 113-135㎡,"车位充足, 绿化率高, 入户花园, 中式建筑",3室,"9800,  元/㎡(均价)"
中森茗苑,增城,新塘北,新塘石新路168号,21000, 元/㎡(均价),总价185(万/套),售罄,建面 85-88㎡,"人车分流, 封闭管理, 入户花园, 儿童乐园",3室,"21000,  元/㎡(均价)"
宏诚海峰花园,从化,江浦街,广州市从化区江埔街环市东路453号,价格待定,,,售罄,建面 79-134㎡,"人车分流, 封闭管理, 健身跑道, 贴心物业","2室, 3室, 4室",价格待定
越秀星汇云城,白云,同和,广州大道北同宝路163号,53000, 元/㎡(均价),总价550(万/套),售罄,建面 78-122㎡,"车位充足, 绿化率高, 国央企, 入户花园","2室, 3室, 4室","53000,  元/㎡(均价)"
盈港国际,南沙,进港大道,广州市南沙区南沙街进港大道577号进港大道盈港国际,14500, 元/㎡(均价),总价140(万/套),售罄,建面 87-139㎡,"绿化率高, 人车分流, 自持商业, 公交直达","1室, 2室, 3室","14500,  元/㎡(均价)"
远东御江豪庭,荔湾,茶滘,百花路58号（花地河畔）,40000, 元/㎡(均价),总价343(万/套),售罄,建面 85-127㎡,"人车分流, 小型社区, 休闲会所, 地铁沿线","0室, 2室, 3室","40000,  元/㎡(均价)"
中海联南沙国贸中心,南沙,金洲,上隆岭路中海联南沙国贸中心,13000, 元/㎡(均价),总价68(万/套),售罄,建面 52-58㎡,"人车分流, 小型社区, 近地铁, 地铁沿线",2室,"13000,  元/㎡(均价)"
家和天曜,天河,黄村,大灵山路430号,33000, 元/㎡(均价),总价135(万/套),售罄,建面 43-52㎡,"绿化率高, 人车分流, 自持商业, 公交直达",2室,"33000,  元/㎡(均价)"
大夫山尚东,番禺,市桥,禺山西路东桥大街68号,24000, 元/㎡(均价),总价220(万/套),售罄,建面 79-110㎡,"绿化率高, 人车分流, 品牌房企, 贴心物业","2室, 3室, 4室","24000,  元/㎡(均价)"
中鼎名汇,黄埔,黄埔区府,广东省广州市黄埔区丰乐北路68号,23500, 元/㎡(均价),总价170(万/套),售罄,建面 49-86㎡,"绿化率高, 人车分流, 贴心物业, 自持商业","1室, 2室","23500,  元/㎡(均价)"
保利罗兰国际4期,黄埔,科学城,开创大道2656号,41000, 元/㎡(均价),总价450(万/套),售罄,建面 54-172㎡,"车位充足, 绿化率高, 国央企, 品牌房企","1室, 2室, 3室","41000,  元/㎡(均价)"
金地香山湖,增城,永宁,永和新新大道15号,12000, 元/㎡(均价),总价160(万/套),售罄,建面 129-170㎡,"人车分流, 小型社区, 品牌房企, 入户花园",4室,"12000,  元/㎡(均价)"
天马丽苑·悦璟湾,花都,铁路西,新街大道望亭路8号,32000, 元/㎡(均价),总价360(万/套),售罄,建面 99-145㎡,"车位充足, 绿化率高, 养老舒适, 入户花园","3室, 4室","32000,  元/㎡(均价)"
增城一品山湖,增城,荔城增江,增江街初溪村（广东工业大学华立学院旁和新建的北汽汽车城对面）,11000, 元/㎡(均价),总价130(万/套),售罄,建面 107-149㎡,"人车分流, 大型社区, 国央企, 品牌房企","3室, 4室","11000,  元/㎡(均价)"
中国铁建环球中心,南沙,南沙区府,广州市南沙区进港大道与丰泽西路交汇处,23000, 元/㎡(均价),,售罄,,"人车分流, 大型社区, 国央企, 品牌房企",,"23000,  元/㎡(均价)"
众筑•东山学府,越秀,环市东,东风东路737号（东风东路小学对面）,价格待定,,,售罄,建面 42-61㎡,"人车分流, 小型社区, 近地铁, 多轨交汇","1室, 2室",价格待定
万科海上传奇,荔湾,芳村,芳村大道珠江隧道口以西,价格待定,,,售罄,,"车位充足, 小型社区, 国央企, 品牌房企",,价格待定
合景誉山国际,增城,永宁,广园东新新公路中段,18000, 元/㎡(均价),总价90(万/套),售罄,,"车位充足, 人车分流, 品牌房企, 贴心物业",,"18000,  元/㎡(均价)"
华发荔湾荟,荔湾,滘口,芳村大道西兴东路（郭村小区以南）,22000, 元/㎡(均价),总价85(万/套),售罄,建面 41-64㎡,"人车分流, 小型社区, 国央企, 品牌房企","2室, 3室","22000,  元/㎡(均价)"
广州国际空港中心,花都,镜湖大道,迎宾大道以南,12000, 元/㎡(均价),总价46(万/套),售罄,建面 35-41㎡,"绿化率高, 人车分流, 国央企, 品牌房企","1室, 2室","12000,  元/㎡(均价)"
招商臻园,增城,新塘北,广园快速荔新出口新塘万达旁,18000, 元/㎡(均价),总价230(万/套),售罄,建面 95-143㎡,"车位充足, 人车分流, 国央企, 品牌房企","3室, 4室, 5室","18000,  元/㎡(均价)"
越秀臻悦府,花都,镜湖大道,花都湖•凤凰南路,30000, 元/㎡(均价),总价290(万/套),售罄,建面 100-120㎡,"车位充足, 绿化率高, 国央企, 品牌房企",4室,"30000,  元/㎡(均价)"
逸合中心,荔湾,鹤洞,浣花路荔湾儿童公园西侧,34000, 元/㎡(均价),总价155(万/套),售罄,建面 30-59㎡,"人车分流, 封闭管理, 品牌房企, 近地铁","2室, 3室","34000,  元/㎡(均价)"
粤泰荣廷府,越秀,东川路,东华西路52-56号,价格待定,,,售罄,,"人车分流, 小型社区, 品牌房企, 近地铁",,价格待定
越秀国际总部广场,南沙,金洲,双山大道与金隆路交汇处,13500, 元/㎡(均价),总价70(万/套),售罄,建面 40-87㎡,"人车分流, 大型社区, 国央企, 品牌房企","2室, 3室, 4室","13500,  元/㎡(均价)"
天河金街,天河,天润路,天河北路曜一城广场负一楼,价格待定,,,售罄,,"车位充足, 小型社区, 近地铁, 地铁沿线",,价格待定
合家和府,从化,旺城片区,城郊街城新路136号,12000, 元/㎡(均价),总价120(万/套),售罄,建面 90-124㎡,"车位充足, 绿化率高, 儿童乐园, 公交直达","2室, 3室","12000,  元/㎡(均价)"
星河·湾区壹号,南沙,金洲,金苑大街与金苑横街交叉口西,13000, 元/㎡(均价),总价80(万/套),售罄,建面 39-73㎡,"人车分流, 封闭管理, 品牌房企, 健身跑道","1室, 2室, 3室","13000,  元/㎡(均价)"
祈福黄金海岸,花都,赤坭镇,赤泥镇培正大道集益水库（培正学院旁）,7888, 元/㎡(均价),总价58(万/套),售罄,建面 73-151㎡,"绿化率高, 低密居所, 贴心物业, 实体样板间","2室, 3室, 4室","7888,  元/㎡(均价)"
海航白云YH城,白云,夏茅,鹤龙一路208号,价格待定,,,售罄,,"小型社区, 品牌房企, 地铁沿线, 公交直达",,价格待定
嘉骏幸福里,从化,旧城区,广州市从化区城郊安园街43号,15500, 元/㎡(均价),总价149(万/套),售罄,建面 89-106㎡,"绿化率高, 人车分流, 健身跑道, 休闲会所",3室,"15500,  元/㎡(均价)"
保利合锦领秀山,增城,荔城增江,增江街陆村村鹅春岭,10000, 元/㎡(均价),,售罄,建面 100-139㎡,"车位充足, 人车分流, 品牌房企, 入户花园","3室, 4室","10000,  元/㎡(均价)"
远洋招商保利东湾,增城,朱村,广东省广州市增城区朱村大道西163号,20000, 元/㎡(均价),总价188(万/套),售罄,建面 96-110㎡,"车位充足, 人车分流, 国央企, 品牌房企","3室, 4室","20000,  元/㎡(均价)"
合汇璟园,增城,增城碧桂园,荔城街荔湖大道397号,35000, 元/㎡(均价),总价800(万/套),售罄,建面 207-250㎡,"车位充足, 人车分流, 品牌房企, 入户花园",4室,"35000,  元/㎡(均价)"
珠光御景壹號,荔湾,黄沙,黄沙大道15-17号,65000, 元/㎡(均价),总价400(万/套),售罄,建面 50-100㎡,"绿化率高, 人车分流, 休闲会所, 自持商业","1室, 2室, 3室","65000,  元/㎡(均价)"
纵横缤城,白云,新市,佳园街37-45号（单）,43000, 元/㎡(均价),总价360(万/套),售罄,建面 71-100㎡,"绿化率高, 人车分流, 地铁沿线, 公交直达","2室, 3室","43000,  元/㎡(均价)"
广州大学城智慧谷,番禺,国际创新城,曾边大街思科智慧城,28600, 元/㎡(均价),总价950(万/套),售罄,建面 340㎡,"人车分流, 大型社区, 品牌房企, 入户花园",1室,"28600,  元/㎡(均价)"
鸿成珠江玥,南沙,万顷沙,广州市珠江街新广六路112号,19000, 元/㎡(均价),总价180(万/套),售罄,建面 77-100㎡,"绿化率高, 低密居所, 养老舒适, 自持商业","2室, 3室","19000,  元/㎡(均价)"
华远雲和墅,白云,东平,白云大道北大一大街23号,90000, 元/㎡(均价),总价2000(万/套),售罄,建面 153-230㎡,"车位充足, 绿化率高, 国央企, 养老舒适","2室, 3室","90000,  元/㎡(均价)"
鸿成珠江玥,南沙,万顷沙,珠江街西新二路（西新社区旁）,价格待定,,,售罄,,"小型社区, 地铁沿线, 公交直达, 已交房超2年",,价格待定
大壮国际广场,黄埔,科学城,开泰大道601号,价格待定,,,售罄,,"大型社区, 近地铁, 地铁沿线, 综合商场",,价格待定
嘉骏幸福里,从化,旧城区,广州市从化区城郊安园街43号,价格待定,,,售罄,,"人车分流, 小型社区, 健身跑道, 贴心物业",,价格待定
越秀臻悦府,花都,镜湖大道,"凤凰南路, 越秀臻悦府",价格待定,,,售罄,,"车位充足, 人车分流, 国央企, 品牌房企",,价格待定
保利阅云台,白云,新市,三元里大道1375号,45000, 元/㎡(均价),总价450(万/套),售罄,建面 99-108㎡,"车位充足, 绿化率高, 国央企, 品牌房企","3室, 4室","45000,  元/㎡(均价)"
时代四季奕居,越秀,水荫,环市东水荫路70号,价格待定,,,售罄,,"绿化率高, 人车分流, 国央企, 品牌房企",,价格待定
南沙.越秀明珠天悦江湾,南沙,明珠湾,庙南路江灵路小学旁越秀明珠天悦江湾,30000, 元/㎡(均价),总价260(万/套),售罄,建面 80-178㎡,"绿化率高, 人车分流, 国央企, 品牌房企","3室, 4室","30000,  元/㎡(均价)"
中国铁建·花语岭南,番禺,金山谷,兴学路西侧,45000, 元/㎡(均价),总价650(万/套),售罄,建面 110-195㎡,"车位充足, 绿化率高, 国央企, 品牌房企","4室, 5室","45000,  元/㎡(均价)"
保利拾光年,黄埔,知识城,广州市黄埔区知识城九龙大道保利拾光年,25500, 元/㎡(均价),总价235(万/套),售罄,建面 61-99㎡,"车位充足, 低密居所, 国央企, 品牌房企","2室, 3室, 4室","25500,  元/㎡(均价)"
